{
  "schemaVersion": "1.0",
  "manifestKind": "release",
  "version": "v0.1.0",
  "generatedAt": "2026-06-10T04:53:51Z",
  "root": {
    "repository": "xxldm/hdx",
    "ref": "refs/tags/v0.1.0",
    "commit": "1111111111111111111111111111111111111111"
  },
  "sources": {
    "backend": {
      "repository": "xxldm/hdx-backend",
      "commit": "2222222222222222222222222222222222222222"
    }
  },
  "openapiSnapshotHash": "aaaaaaaaaaaaaaaaaaaaaaaaaaaaaaaaaaaaaaaaaaaaaaaaaaaaaaaaaaaaaaaa",
  "backendNativeManifest": {
    "fileName": "backend-native-manifest.json",
    "sha256": "d117ff294d95744808b898c7acc6dc83f7269f0734d2177333816dfd175bfc27",
    "backendCommit": "2222222222222222222222222222222222222222",
    "source": {
      "type": "github-actions-artifact",
      "githubActions": {
        "workflow": "Backend Native Artifact",
        "runId": 123456789,
        "runAttempt": 1,
        "artifactName": "multi-backend-native-assets-v0.1.0"
      },
      "githubActionsArtifacts": [
        {
          "kind": "backend-full",
          "platform": "linux-x64",
          "githubActions": {
            "workflow": "Backend Native Artifact",
            "runId": 123456789,
            "runAttempt": 1,
            "artifactName": "hdx-backend-full-native-v0.1.0-linux-x64",
            "artifactId": 1001
          }
        },
        {
          "kind": "backend-services",
          "platform": "linux-x64",
          "githubActions": {
            "workflow": "Backend Native Artifact",
            "runId": 123456789,
            "runAttempt": 1,
            "artifactName": "hdx-backend-services-native-v0.1.0-linux-x64",
            "artifactId": 1002
          }
        }
      ]
    }
  },
  "assets": [
    {
      "kind": "backend-full",
      "platform": "linux-x64",
      "fileName": "hdx-backend-full-linux-x64-v0.1.0.tar.gz",
      "contentType": "application/gzip",
      "sha256": "385875b7627f16e4a43293ef76e22665bdf6131bc1ebda1708b6d416c41177e0",
      "sizeBytes": 161,
      "source": {
        "type": "backend",
        "commit": "2222222222222222222222222222222222222222",
        "manifestSha256": "d117ff294d95744808b898c7acc6dc83f7269f0734d2177333816dfd175bfc27",
        "openapiSnapshotHash": "aaaaaaaaaaaaaaaaaaaaaaaaaaaaaaaaaaaaaaaaaaaaaaaaaaaaaaaaaaaaaaaa",
        "githubActions": {
          "workflow": "Backend Native Artifact",
          "runId": 123456789,
          "runAttempt": 1,
          "artifactName": "hdx-backend-full-native-v0.1.0-linux-x64",
          "artifactId": 1001
        },
        "backendNativeFingerprint": {
          "algorithm": "hdx-backend-native-fingerprint-v1",
          "sha256": "35fe2d739c40f97c09d514644f904a9d66707c03bc51352be4e59be03f1b3eba",
          "backend": {
            "repository": "xxldm/hdx-backend",
            "commit": "2222222222222222222222222222222222222222"
          },
          "artifact": {
            "kind": "backend-full",
            "platform": "linux-x64",
            "packaging": "tar.gz",
            "entrypoints": [
              "bin/hdx-backend"
            ]
          },
          "openapiSnapshotHash": "aaaaaaaaaaaaaaaaaaaaaaaaaaaaaaaaaaaaaaaaaaaaaaaaaaaaaaaaaaaaaaaa",
          "packaging": {
            "manifestSchemaVersion": "1.0",
            "packagingScriptVersion": "test-fixture"
          },
          "runtime": {
            "javaVersion": "25",
            "graalvmVersion": "GraalVM Native Image 25"
          },
          "nativeInputs": {
            "mavenProfile": "native",
            "nativeImageArgs": [
              "-Dnative.skip=false"
            ],
            "springAot": {
              "enabled": true
            },
            "runtimeHints": [
              "Spring AOT generated runtime hints"
            ],
            "reachabilityMetadata": [
              "GraalVM Reachability Metadata Repository"
            ],
            "nativeMetadata": [
              "Hibernate enhance"
            ]
          }
        }
      }
    },
    {
      "kind": "backend-services",
      "platform": "linux-x64",
      "fileName": "hdx-backend-services-linux-x64-v0.1.0.tar.gz",
      "contentType": "application/gzip",
      "sha256": "d1d245c11070d78478d598d73ab59ab312474931b1c5c1b16db1d22600362e39",
      "sizeBytes": 220,
      "source": {
        "type": "backend",
        "commit": "2222222222222222222222222222222222222222",
        "manifestSha256": "d117ff294d95744808b898c7acc6dc83f7269f0734d2177333816dfd175bfc27",
        "openapiSnapshotHash": "aaaaaaaaaaaaaaaaaaaaaaaaaaaaaaaaaaaaaaaaaaaaaaaaaaaaaaaaaaaaaaaa",
        "githubActions": {
          "workflow": "Backend Native Artifact",
          "runId": 123456789,
          "runAttempt": 1,
          "artifactName": "hdx-backend-services-native-v0.1.0-linux-x64",
          "artifactId": 1002
        },
        "backendNativeFingerprint": {
          "algorithm": "hdx-backend-native-fingerprint-v1",
          "sha256": "7e2923b94d19161f6c70bc7479dd866900324dcfdd81d9e22ab122b7f83fdc03",
          "backend": {
            "repository": "xxldm/hdx-backend",
            "commit": "2222222222222222222222222222222222222222"
          },
          "artifact": {
            "kind": "backend-services",
            "platform": "linux-x64",
            "packaging": "tar.gz",
            "entrypoints": [
              "bin/hdx-auth-service",
              "bin/hdx-gateway",
              "bin/hdx-core-service"
            ]
          },
          "services": [
            {
              "id": "hdx-auth-service",
              "module": "backend-auth-service",
              "executablePath": "bin/hdx-auth-service"
            },
            {
              "id": "hdx-gateway",
              "module": "backend-gateway",
              "executablePath": "bin/hdx-gateway"
            },
            {
              "id": "hdx-core-service",
              "module": "backend-core-service",
              "executablePath": "bin/hdx-core-service"
            }
          ],
          "openapiSnapshotHash": "aaaaaaaaaaaaaaaaaaaaaaaaaaaaaaaaaaaaaaaaaaaaaaaaaaaaaaaaaaaaaaaa",
          "packaging": {
            "manifestSchemaVersion": "1.0",
            "packagingScriptVersion": "test-fixture"
          },
          "runtime": {
            "javaVersion": "25",
            "graalvmVersion": "GraalVM Native Image 25"
          },
          "nativeInputs": {
            "mavenProfile": "native",
            "nativeImageArgs": [
              "-Dnative.skip=false"
            ],
            "springAot": {
              "enabled": true
            },
            "runtimeHints": [
              "Spring AOT generated runtime hints"
            ],
            "reachabilityMetadata": [
              "GraalVM Reachability Metadata Repository"
            ],
            "nativeMetadata": [
              "Hibernate enhance"
            ]
          }
        }
      }
    }
  ]
}
